{
  "schema_version": "exp4-e4v1-prospective-config-v1",
  "experiment_id": "E4V1",
  "freeze_status": "prospective_unready",
  "task_ids": [
    "T1",
    "T2",
    "T3"
  ],
  "replicate_count": 4,
  "conditions": {
    "M0R0": {
      "architecture_mode": "single_agent",
      "rag_enabled": false,
      "retrieval_context_included": false,
      "role_topology": "single_agent"
    },
    "M0R1": {
      "architecture_mode": "single_agent",
      "rag_enabled": true,
      "retrieval_context_included": true,
      "role_topology": "single_agent"
    },
    "M1R0": {
      "architecture_mode": "manager_star",
      "rag_enabled": false,
      "retrieval_context_included": false,
      "role_topology": "manager_star"
    },
    "M1R1": {
      "architecture_mode": "manager_star",
      "rag_enabled": true,
      "retrieval_context_included": true,
      "role_topology": "manager_star"
    }
  },
  "williams_order": {
    "1": ["M0R0", "M0R1", "M1R1", "M1R0"],
    "2": ["M0R1", "M1R0", "M0R0", "M1R1"],
    "3": ["M1R0", "M1R1", "M0R1", "M0R0"],
    "4": ["M1R1", "M0R0", "M1R0", "M0R1"]
  },
  "block_order_seed": "E4V1-four-cell-block-order-v1",
  "source": {
    "repository": "bankingscience/BSLAgenticQuantDevLoop",
    "source_ref": "__UNRESOLVED_SOURCE_REF__",
    "source_commit": "__UNRESOLVED_SOURCE_COMMIT_SHA__"
  },
  "control": {
    "repository": "bankingscience/BSLAgenticQuantDevLoop",
    "control_ref": "__UNRESOLVED_CONTROL_REF__",
    "control_commit": "__UNRESOLVED_CONTROL_COMMIT_SHA__",
    "control_files": [
      {"path": "experiments/exp4/README.md", "sha256": "__UNRESOLVED_E4_README_SHA256__"},
      {"path": "experiments/exp4/schemas/e4v1_config.schema.json", "sha256": "__UNRESOLVED_E4_CONFIG_SCHEMA_SHA256__"},
      {"path": "experiments/exp4/identity.py", "sha256": "__UNRESOLVED_E4_IDENTITY_SHA256__"},
      {"path": "experiments/exp4/build_e4v1_agreement.py", "sha256": "__UNRESOLVED_E4_BUILDER_SHA256__"},
      {"path": "experiments/exp4/preflight_e4v1.py", "sha256": "__UNRESOLVED_E4_PREFLIGHT_SHA256__"},
      {"path": "experiments/exp4/PROTOCOL_DRAFT.md", "sha256": "__UNRESOLVED_E4_PROTOCOL_SHA256__"}
    ]
  },
  "runtime": {
    "image_ref": "__UNRESOLVED_IMAGE_REF__",
    "image_digest": "__UNRESOLVED_IMAGE_DIGEST__",
    "formal_execution_contract": "factorial_rag_architecture_v1",
    "rag_delivery_policy": "all_model_stages_v1",
    "runtime_request_schema_sha256": "__UNRESOLVED_RUNTIME_REQUEST_SCHEMA_SHA256__",
    "runtime_response_schema_sha256": "__UNRESOLVED_RUNTIME_RESPONSE_SCHEMA_SHA256__",
    "item_submission_schema_sha256": "__UNRESOLVED_T3_V2_ITEM_SCHEMA_SHA256__",
    "tool_implementation_sha256": "__UNRESOLVED_TOOL_IMPLEMENTATION_SHA256__",
    "model_visible_tool_fingerprint_sha256": "__UNRESOLVED_MODEL_VISIBLE_TOOL_FINGERPRINT_SHA256__",
    "provider_identity_sha256": "__UNRESOLVED_PROVIDER_IDENTITY_SHA256__",
    "provider_mode": "openai",
    "provider_base_url": "https://api.openai.com/v1",
    "model_alias": "gpt-5.6-terra"
  },
  "task_bindings": {
    "T1": {
      "answer_capture_profile": null,
      "task_text_path": "__UNRESOLVED_T1_TASK_TEXT_PATH__",
      "task_text_sha256": "__UNRESOLVED_T1_TASK_TEXT_SHA256__",
      "public_inputs": []
    },
    "T2": {
      "answer_capture_profile": null,
      "task_text_path": "__UNRESOLVED_T2_TASK_TEXT_PATH__",
      "task_text_sha256": "__UNRESOLVED_T2_TASK_TEXT_SHA256__",
      "public_inputs": []
    },
    "T3": {
      "suite_version": "t3-quant-suite-v2",
      "answer_capture_profile": "t3_item_results_v2",
      "suite_root": "experiments/shared/t3-quant-suite-v2",
      "task_text_path": "experiments/shared/t3-quant-suite-v2/TASK.md",
      "task_text_sha256": "__UNRESOLVED_T3_V2_TASK_SHA256__",
      "rubric_path": "experiments/shared/t3-quant-suite-v2/RUBRIC.md",
      "rubric_sha256": "__UNRESOLVED_T3_V2_RUBRIC_SHA256__",
      "public_inputs": [
        {
          "path": "experiments/shared/t3-quant-suite-v2/input/synthetic_portfolio_returns_v1.csv",
          "sha256": "__UNRESOLVED_T3_V2_RETURNS_SHA256__"
        },
        {
          "path": "experiments/shared/t3-quant-suite-v2/input/portfolio_config_v1.json",
          "sha256": "__UNRESOLVED_T3_V2_CONFIG_SHA256__"
        }
      ],
      "item_submission_schema_path": "experiments/shared/t3-quant-suite-v2/item_submission_schema_v2.json",
      "item_submission_schema_sha256": "__UNRESOLVED_T3_V2_ITEM_SCHEMA_SHA256__",
      "output_schema_path": "experiments/shared/t3-quant-suite-v2/output_schema_v1.json",
      "output_schema_sha256": "__UNRESOLVED_T3_V2_OUTPUT_SCHEMA_SHA256__",
      "result_contract": {
        "scorer_result_schema_path": "experiments/shared/t3-quant-suite-v2/scorer_result_schema_v2.json",
        "scorer_result_schema_sha256": "__UNRESOLVED_T3_V2_SCORER_RESULT_SCHEMA_SHA256__",
        "scorer_result_validator_path": "experiments/shared/t3-quant-suite-v2/scorer_result_validator.py",
        "scorer_result_validator_sha256": "__UNRESOLVED_T3_V2_SCORER_RESULT_VALIDATOR_SHA256__",
        "scorer_result_schema_version": "t3-quant-scorer-result-v2",
        "primary_outcome": "correct_items_out_of_25",
        "required_item_count": 25,
        "required_item_ids": [1, 2, 3, 4, 5, 6, 7, 8, 9, 10, 11, 12, 13, 14, 15, 16, 17, 18, 19, 20, 21, 22, 23, 24, 25],
        "reported_item_states": ["accepted", "invalid_format", "explicit_abstain", "tool_failure", "not_attempted"],
        "item_state_is_separate_from_mathematical_correctness": true,
        "missing_items_reduce_correct_items_out_of_25": true,
        "missing_reported_separately_from_submitted_incorrect": true,
        "saved_accepted_items_survive_runtime_failure": true,
        "latest_accepted_saved_candidate_is_primary": true,
        "checkpoint_or_artifact_fills_only_missing_items": true
      }
    }
  },
  "evaluator_bindings": {
    "T1": "__UNRESOLVED_T1_EVALUATOR_SHA256__",
    "T2": "__UNRESOLVED_T2_EVALUATOR_SHA256__",
    "T3": "__UNRESOLVED_T3_EVALUATOR_SHA256__",
    "coordinator_sha256": "__UNRESOLVED_EVALUATOR_COORDINATOR_SHA256__"
  },
  "retrieval_binding": {
    "task_query_context": {
      "T1": {
        "query_path": "__UNRESOLVED_T1_RETRIEVAL_QUERY_PATH__",
        "query_sha256": "__UNRESOLVED_T1_RETRIEVAL_QUERY_SHA256__",
        "retrieval_context_path": "__UNRESOLVED_T1_RETRIEVAL_CONTEXT_PATH__",
        "retrieval_context_sha256": "__UNRESOLVED_T1_RETRIEVAL_CONTEXT_SHA256__",
        "retrieval_context_byte_count": "__UNRESOLVED_T1_RETRIEVAL_CONTEXT_BYTE_COUNT__",
        "memory_count": "__UNRESOLVED_T1_RETRIEVAL_MEMORY_COUNT__"
      },
      "T2": {
        "query_path": "__UNRESOLVED_T2_RETRIEVAL_QUERY_PATH__",
        "query_sha256": "__UNRESOLVED_T2_RETRIEVAL_QUERY_SHA256__",
        "retrieval_context_path": "__UNRESOLVED_T2_RETRIEVAL_CONTEXT_PATH__",
        "retrieval_context_sha256": "__UNRESOLVED_T2_RETRIEVAL_CONTEXT_SHA256__",
        "retrieval_context_byte_count": "__UNRESOLVED_T2_RETRIEVAL_CONTEXT_BYTE_COUNT__",
        "memory_count": "__UNRESOLVED_T2_RETRIEVAL_MEMORY_COUNT__"
      },
      "T3": {
        "query_path": "__UNRESOLVED_T3_RETRIEVAL_QUERY_PATH__",
        "query_sha256": "__UNRESOLVED_T3_RETRIEVAL_QUERY_SHA256__",
        "retrieval_context_path": "__UNRESOLVED_T3_RETRIEVAL_CONTEXT_PATH__",
        "retrieval_context_sha256": "__UNRESOLVED_T3_RETRIEVAL_CONTEXT_SHA256__",
        "retrieval_context_byte_count": "__UNRESOLVED_T3_RETRIEVAL_CONTEXT_BYTE_COUNT__",
        "memory_count": "__UNRESOLVED_T3_RETRIEVAL_MEMORY_COUNT__"
      }
    },
    "retriever_name": "__UNRESOLVED_RETRIEVER_NAME__",
    "retriever_version": "__UNRESOLVED_RETRIEVER_VERSION__",
    "corpus_id": "__UNRESOLVED_CORPUS_ID__",
    "corpus_sha256": "__UNRESOLVED_CORPUS_SHA256__",
    "index_id": "__UNRESOLVED_INDEX_ID__",
    "index_sha256": "__UNRESOLVED_INDEX_SHA256__",
    "exclusion_list_id": "__UNRESOLVED_EXCLUSION_LIST_ID__",
    "exclusion_list_sha256": "__UNRESOLVED_EXCLUSION_LIST_SHA256__",
    "cutoff_at": "__UNRESOLVED_RETRIEVAL_CUTOFF__",
    "requested_top_k": 5,
    "max_memories_per_source_ticket": 2
  },
  "shared_budget": {
    "max_attempts": 2,
    "max_model_calls_per_attempt": 20,
    "max_tokens_per_attempt": 350000,
    "max_model_calls_per_observation": 40,
    "max_tokens_per_observation": 700000,
    "attempt_timeout_seconds": 1800,
    "observation_timeout_seconds": 3600,
    "cpu_vcpus": 2,
    "memory_mb": 4096,
    "pids_limit": 256
  },
  "manager_star_role_budget": {
    "manager": {"max_calls": 3, "max_tokens": 350000},
    "architect": {"max_calls": 3, "max_tokens": 350000},
    "developer": {"max_calls": 14, "max_tokens": 350000},
    "unused_capacity_transferable": true,
    "applies_per_attempt": true
  },
  "execution": {
    "serial": true,
    "observations_per_authorization": 4,
    "advance_only_after_block_audit": true,
    "agreement_generation_enabled": false,
    "formal_model_execution_enabled": false
  }
}
